{
  "policy_id": "policy.reroute-cost-check",
  "policy_name": "reroute_requires_cost_check",
  "policy_type": "advisory",
  "rules": [
    {
      "rule_id": "rule.reroute-cost-threshold",
      "rule_name": "Reroute cost soft threshold",
      "rule_type": "condition",
      "condition": {
        "field": "proposed_action.parameters.cost_delta_percent",
        "operator": ">",
        "value": 5
      },
      "outcome": "warn",
      "evaluation_mode": "deterministic",
      "created_at": "2026-03-08T10:00:00Z",
      "version": 1
    }
  ],
  "default_outcome": "allow",
  "created_at": "2026-03-08T10:00:00Z",
  "version": 1
}
