{
  "policy_id": "policy.world-game.approval-thresholds.v1",
  "policy_name": "world_game_approval_thresholds",
  "policy_type": "approval",
  "rules": [
    {
      "rule_id": "rule.world-game.approval.total-cost",
      "rule_name": "Require approval above cost threshold",
      "rule_type": "approval_trigger",
      "condition": {
        "field": "proposed_action.parameters.total_cost",
        "operator": ">",
        "value": 8000
      },
      "outcome": "require_approval",
      "evaluation_mode": "deterministic",
      "created_at": "2026-03-11T00:00:00Z",
      "version": 1
    },
    {
      "rule_id": "rule.world-game.approval.multi-region-impact",
      "rule_name": "Require approval for broad regional impact",
      "rule_type": "approval_trigger",
      "condition": {
        "field": "proposed_action.parameters.affected_region_count",
        "operator": ">",
        "value": 2
      },
      "outcome": "require_approval",
      "evaluation_mode": "deterministic",
      "created_at": "2026-03-11T00:00:00Z",
      "version": 1
    },
    {
      "rule_id": "rule.world-game.approval.warn-low-composite",
      "rule_name": "Warn low projected composite",
      "rule_type": "advisory",
      "condition": {
        "field": "proposed_action.parameters.projected_composite_score",
        "operator": "<",
        "value": 50
      },
      "outcome": "warn",
      "evaluation_mode": "deterministic",
      "created_at": "2026-03-11T00:00:00Z",
      "version": 1
    }
  ],
  "default_outcome": "allow",
  "created_at": "2026-03-11T00:00:00Z",
  "version": 1
}
